{
  "connectorName": "typedescProject",
  "operationName": "processTypedescAnydata",
  "title": "process typedesc anydata",
  "help": "",
  "elements": [
    {
      "type": "attributeGroup",
      "value": {
        "groupName": "General",
        "elements": [
          {
            "type": "attribute",
            "value": {
              "name": "configRef",
              "displayName": "Connection",
              "inputType": "connection",
              "allowedConnectionTypes": [
                "typedescProject_TypedescClient"
              ],
              "defaultType": "connection.typedescProject_TypedescClient",
              "defaultValue": "",
              "required": "true",
              "helpTip": "Connection to be used"
            }
          },
          {
            "type": "attributeGroup",
            "value": {
              "groupName": "Input Variables",
              "elements": [
                {
                  "type": "attribute",
                  "value": {
                    "name": "payload",
                    "displayName": "payload",
                    "inputType": "stringOrExpression",
                    "defaultValue": "",
                    "required": true,
                    "helpTip": "Expecting JSON object",
                    "validateType": "json",
                    "matchPattern": ""
                  }
                },
                {
                  "type": "attributeGroup",
                  "value": {
                    "groupName": "Advanced",
                    "collapsed": true,
                    "elements": []
                  }
                }
              ]
            }
          },
          {
            "type": "attributeGroup",
            "value": {
              "groupName": "Output",
              "elements": [
                {
                  "type": "attribute",
                  "value": {
                    "name": "responseVariable",
                    "displayName": "Output Variable Name",
                    "inputType": "string",
                    "defaultValue": "",
                    "required": "false",
                    "helpTip": "The target variable in which the output of the operation will be stored"
                  }
                },
                {
                  "type": "attribute",
                  "value": {
                    "name": "overwriteBody",
                    "displayName": "Overwrite Message Body",
                    "inputType": "checkbox",
                    "defaultValue": "false",
                    "helpTip": "Replace the Message Body in Message Context with the output payload of the operation (This will remove the payload from the above variable. But other elements such as headers and attributes will remain).",
                    "required": "false"
                  }
                }
              ]
            }
          }
        ]
      }
    }
  ]
}