{
  "connectorName": "typedescProject",
  "connectionName": "typedescProject_TypedescClient",
  "title": "Connection Config for typedescProject_TypedescClient connection",
  "help": "<h1>typedescProject_TypedescClient Connection</h1> <b></b>",
  "elements": [
    {
      "type": "attribute",
      "value": {
        "name": "connectionName",
        "displayName": "Connection Name",
        "inputType": "string",
        "defaultValue": "typedescProject_TypedescClient_connection_1",
        "required": "true",
        "helpTip": "The name for the typedescProject_TypedescClient connection",
        "validation": "nameWithoutSpecialCharactors"
      }
    },
    {
      "type": "attributeGroup",
      "value": {
        "groupName": "General",
        "elements": [
          {
            "type": "attributeGroup",
            "value": {
              "groupName": "Advanced",
              "collapsed": true,
              "elements": [
                {
                  "type": "attribute",
                  "value": {
                    "name": "serviceUrl",
                    "displayName": "serviceUrl",
                    "inputType": "stringOrExpression",
                    "defaultValue": "https://test.sh",
                    "required": false,
                    "helpTip": "",
                    "validateType": "",
                    "matchPattern": ""
                  }
                }
              ]
            }
          }
        ]
      }
    }
  ]
}